{"$schema":"https://raw.githubusercontent.com/ethanvillalovoz/planmargin/main/schemas/test-operations-report-v2.schema.json","campaign":{"behavior_outcome":"no_qualifying_regression","campaign_id":"natural-development-v1","completed_cells":100,"execution_health":"healthy","physical_rollouts":14110,"planned_cells":100,"proposals":3200,"real_data_only":true,"recorded_work_seconds":30140.262755,"waymax_steps":1128800},"claim_boundary":"Independent research evidence from bounded Waymo Open Dataset training scenes; not a Waymo Driver, fleet-health, or safety claim.","coverage":{"assistance_handoff":{"exact_transition_count":10,"fault":"temporary planner-command dropout","physical_rollouts":60,"plan_version":"command-recovery-v1","protected_behavior":"fallback until deterministic assistance resolution","scenario_count":10,"scene_gate_passes":90,"scene_gate_total":90,"status":"qualified"},"cells":100,"fault_protection":{"fault":"sustained planner-command dropout","physical_rollouts":60,"plan_version":"command-dropout-v1","protected_behavior":"conservative IDM fallback","scenario_count":10,"scene_gate_passes":80,"scene_gate_total":80,"status":"qualified"},"known_gaps":[{"id":"simulator_diversity","label":"Cross-simulator agreement","next_test":"Repeat the frozen test contract in a second simulator.","status":"not_covered"},{"id":"scheduled_completion_latency","label":"Scheduled completion latency","next_test":"Preregister per-suite wall-clock deadlines before the next campaign.","status":"not_covered"}],"methods":{"bayesian":{"eligible_count":1110,"eligible_rate":0.69375,"proposal_count":1600},"random":{"eligible_count":873,"eligible_rate":0.545625,"proposal_count":1600}},"mutation_dimensions":["lead speed multiplier","braking onset offset"],"plan_version":"lead-braking-v1","scenario_count":10,"scenario_family":"lead_vehicle_braking","search_methods":2,"seeds":5,"versioned_plans":[{"gate_passes":807,"gate_total":807,"id":"lead_braking","plan_version":"lead-braking-v1","scenario_count":10,"scenario_family":"lead_vehicle_braking","status":"qualified","test_cell_count":100},{"gate_passes":80,"gate_total":80,"id":"command_dropout","plan_version":"command-dropout-v1","scenario_count":10,"scenario_family":"lead_vehicle_braking_with_command_dropout","status":"qualified","test_cell_count":10},{"gate_passes":90,"gate_total":90,"id":"assistance_handoff","plan_version":"command-recovery-v1","scenario_count":10,"scenario_family":"lead_vehicle_braking_with_assistance_handoff","status":"qualified","test_cell_count":10}]},"evidence_mode":"published_aggregate","issues":[{"component":"TensorRT FP16 promotion","diagnostic":{"detected_by":"FP16 batch-256 numerical-parity gate","impact":"FP16 promotion is blocked; the measured FP32 path remains available.","owner":"inference qualification","prevention":"Run numerical-parity gates at every supported batch size before promotion.","resolution":"Keep FP32 and qualify the residual FP16 candidate on the same T4 protocol.","root_cause_path":["trajectory predictor","ONNX export","TensorRT FP16 engine","batch-256 parity gate"]},"evidence":"Batch 256 max drift 0.101 m exceeds the 0.075 m gate.","failed_gates":["fp16_max_error_under_7_5e_2_m"],"id":"PM-TRT-002","next_action":"Keep FP32; qualify the residual FP16 candidate independently.","severity":"high","source":"experiments/tensorrt-qualification-v2.json","state":"blocked","title":"Scaled FP16 drift exceeds the promotion gate"},{"component":"Active-risk proposal ranking","diagnostic":{"detected_by":"leave-one-scenario-out promotion suite","impact":"The learned selector is excluded from the campaign path.","owner":"proposal ranking","prevention":"Require cross-scenario qualification before a learned selector can enter the campaign path.","resolution":"Retain deterministic search for this protocol.","root_cause_path":["real proposal targets","leave-one-scenario-out split","active-risk ranker","four promotion gates"]},"evidence":"4 promotion gates failed.","failed_gates":["budget_8_advantage_at_least_0_25_m","budget_8_wins_at_least_7_scenarios","coverage_between_0_75_and_0_98","mean_spearman_at_least_0_25"],"id":"PM-RANK-006","next_action":"Retain deterministic search; redesign only under a new protocol.","severity":"medium","source":"experiments/active-risk-qualification-v2.json","state":"stopped","title":"Learned ranker did not generalize across scenarios"},{"component":"Residual FP16 candidate","diagnostic":{"detected_by":"deployment-evidence completeness gate","impact":"The candidate remains unavailable for promotion.","owner":"inference qualification","prevention":"Treat local numerical checks as preflight evidence, never deployment evidence.","resolution":"Run the frozen candidate in the existing free-T4 notebook.","root_cause_path":["residual candidate","local MPS numerical proxy","missing T4 TensorRT qualification"]},"evidence":"Four local proxy gates pass; no TensorRT promotion claim is made.","failed_gates":[],"id":"PM-TRT-011","next_action":"Run the frozen candidate in a free T4 runtime before promotion.","severity":"medium","source":"experiments/fp16-residual-candidate-v1.json","state":"pending_evidence","title":"Local numerical proxy passed; TensorRT evidence is still required"}],"pipeline_stages":[{"detail":"Deterministic selection and baseline replay gates passed.","id":"selection","name":"Scenario selection","observed":"10 selected from 455 scanned records","status":"healthy"},{"detail":"Matched random and Bayesian budgets completed.","id":"proposal","name":"Counterfactual generation","observed":"3,200 proposals","status":"healthy"},{"detail":"Reference and tested planners executed under identical mutations.","id":"simulation","name":"Closed-loop validation","observed":"14,110 rollouts","status":"healthy"},{"detail":"DuckDB aggregates reconcile with sealed campaign records.","id":"analytics","name":"Coverage analytics","observed":"807 integrity checks","status":"healthy"},{"detail":"Selective retention is explicit; full proposal paths remain private.","id":"replay","name":"Exact replay retention","observed":"10 priority replays","status":"healthy"},{"detail":"Sustained command dropout triggered at 2.0 s in 60 deterministic rollouts.","id":"fault_v_and_v","name":"Fault-injection V&V","observed":"10/10 protected fallbacks pass","status":"healthy"},{"detail":"Fault, request, fallback, resolution, and recovery verified in 60 repeated rollouts.","id":"assistance_v_and_v","name":"Assistance handoff V&V","observed":"10/10 handoffs pass","status":"healthy"}],"record_type":"planmargin.test_operations_report","report_sha256":"a531f25bd695abde06bd4dd4162db5a0d37ebbb3d1dd3ffc90da3c696d69cd64","schema_version":"2.0.0","slo_summary":{"passing":7,"status":"healthy","total":7},"slos":[{"error_budget_remaining_percent":100.0,"id":"cell_completion","indicator":"completed release cells / planned release cells","name":"Campaign cells complete","objective":1.0,"observed":"100 of 100","observed_value":1.0,"owner":"orchestration","status":"pass","target":"100 of 100"},{"error_budget_remaining_percent":100.0,"id":"integrity","indicator":"passing integrity checks / integrity checks","name":"Integrity checks pass","objective":1.0,"observed":"807 of 807","observed_value":1.0,"owner":"evidence pipeline","status":"pass","target":"100%"},{"error_budget_remaining_percent":100.0,"id":"proposal_budget","indicator":"completed proposals / frozen proposal budget","name":"Proposal budget exact","objective":1.0,"observed":"3,200","observed_value":1.0,"owner":"search coordinator","status":"pass","target":"3,200"},{"error_budget_remaining_percent":100.0,"id":"method_balance","indicator":"search methods with the frozen matched budget / methods","name":"Matched method budgets","objective":1.0,"observed":"1,600 bayesian \u00b7 1,600 random","observed_value":1.0,"owner":"experiment design","status":"pass","target":"1,600 each"},{"error_budget_remaining_percent":100.0,"id":"retained_replays","indicator":"verified retained replays / selected retained replays","name":"Retained replays verified","objective":1.0,"observed":"10 of 10","observed_value":1.0,"owner":"replay evidence","status":"pass","target":"10 retained"},{"error_budget_remaining_percent":100.0,"id":"fault_fallback","indicator":"scenes passing fallback V&V / evaluated scenes","name":"Command-dropout fallback","objective":1.0,"observed":"10 of 10 scenes","observed_value":1.0,"owner":"behavior V&V","status":"pass","target":"10 of 10 scenes"},{"error_budget_remaining_percent":100.0,"id":"assistance_handoff","indicator":"scenes passing handoff V&V / evaluated scenes","name":"Assistance handoff recovery","objective":1.0,"observed":"10 of 10 scenes","observed_value":1.0,"owner":"behavior V&V","status":"pass","target":"10 of 10 scenes"}],"source_seals":{"active_risk_report_sha256":"8da5718ae26583d16badf207c9ebf487e84681f9844162759b0b88636d22810c","analytics_manifest_sha256":"31e875d433d740d84f798f100812e0d74308b049169249c0de5f4f8dfabe70fa","assistance_handoff_report_sha256":"fec0f41d577f1637c9fd7f6c0a31cc177bc256c5e73b7743eb1dfa4aea2479c6","campaign_manifest_sha256":"ab65937bb3c873f02e6525e73fbe8fa8c9502fc0f03f351a8a6498342731b4a6","campaign_report_sha256":"6d9076b45f3720883580a835b5ddda0f56bfc47c0fde05f95e2778a556ef71dd","fault_protection_report_sha256":"e8b607c566b21147c005a7af6784a7208814a70c1c5a33e745469220f926a791","tensorrt_report_sha256":"3616ab80c88919efb4fe62a2887d53b4043cc950b8dda28983dccdef716be9b2"},"test_inventory":{"active_health_alerts":0,"held_decisions":3,"passing_release_critical_cells":120,"release_critical_cells":120,"suites":[{"execution_count":14110,"execution_unit":"physical rollouts","gate_passes":807,"gate_total":807,"id":"lead_braking","name":"Lead-vehicle braking","owner":"behavior V&V","plan_version":"lead-braking-v1","platform":"Waymax","scenario_count":10,"status":"healthy","test_cell_count":100},{"execution_count":60,"execution_unit":"physical rollouts","gate_passes":80,"gate_total":80,"id":"